Enter password: ******
Welcome to the MySQL monitor.  Commands end with ; or \g.
Your MySQL connection id is 10
Server version: 8.0.20 MySQL Community Server - GPL

Copyright (c) 2000, 2020, Oracle and/or its affiliates. All rights reserved.

Oracle is a registered trademark of Oracle Corporation and/or its
affiliates. Other names may be trademarks of their respective
owners.

Type 'help;' or '\h' for help. Type '\c' to clear the current input statement.

mysql> show databases;
+--------------------+
| Database           |
+--------------------+
| banking            |
| himanshu           |
| information_schema |
| mysql              |
| performance_schema |
| sakila             |
| sys                |
| world              |
+--------------------+
8 rows in set (0.00 sec)

mysql> create database movie;
Query OK, 1 row affected (0.00 sec)

mysql> use movie;
Database changed
mysql> create table movie(movieId varchar(6) , title varchar(30) , releaseDate date , movieRank varchar(5) , primary key(movieId));
Query OK, 0 rows affected (0.10 sec)

mysql> describe movie;
+-------------+-------------+------+-----+---------+-------+
| Field       | Type        | Null | Key | Default | Extra |
+-------------+-------------+------+-----+---------+-------+
| movieId     | varchar(6)  | NO   | PRI | NULL    |       |
| title       | varchar(30) | YES  |     | NULL    |       |
| releaseDate | date        | YES  |     | NULL    |       |
| movieRank   | varchar(5)  | YES  |     | NULL    |       |
+-------------+-------------+------+-----+---------+-------+
4 rows in set (0.01 sec)

mysql> insert into movie values('A2G' , 'Mard Ki Zabaan' , '1987-2-14' , 'A+');
Query OK, 1 row affected (0.01 sec)

mysql> insert into movie values('A2F' , 'Mard Ki Zabaan' , '1988-12-8' , 'B+');
Query OK, 1 row affected (0.00 sec)

mysql> insert into movie values('BFC' , 'Godzilla Mere Saathi' , '2015-8-22' , 'A');
Query OK, 1 row affected (0.01 sec)

mysql> select * from movie;
+---------+----------------------+-------------+-----------+
| movieId | title                | releaseDate | movieRank |
+---------+----------------------+-------------+-----------+
| A2F     | Mard Ki Zabaan       | 1988-12-08  | B+        |
| A2G     | Mard Ki Zabaan       | 1987-02-14  | A+        |
| BFC     | Godzilla Mere Saathi | 2015-08-22  | A         |
+---------+----------------------+-------------+-----------+
3 rows in set (0.00 sec)

mysql> update movie set title = 'Maa Kasam Badla Loonga' where title = 'Mard ki Zabaan' and movieId = 'A2G'
    -> ;
Query OK, 1 row affected (0.00 sec)
Rows matched: 1  Changed: 1  Warnings: 0

mysql> select * from movie;
+---------+------------------------+-------------+-----------+
| movieId | title                  | releaseDate | movieRank |
+---------+------------------------+-------------+-----------+
| A2F     | Mard Ki Zabaan         | 1988-12-08  | B+        |
| A2G     | Maa Kasam Badla Loonga | 1987-02-14  | A+        |
| BFC     | Godzilla Mere Saathi   | 2015-08-22  | A         |
+---------+------------------------+-------------+-----------+
3 rows in set (0.00 sec)

mysql> create table director(dId varchar(6) , FName varchar(30) , LName varchar(30) , gender varchar(10) , primary kry(dId));
ERROR 1064 (42000): You have an error in your SQL syntax; check the manual that corresponds to your MySQL server version for the right syntax to use near 'kry(dId))' at line 1
mysql> create table director(dId varchar(6) , FName varchar(30) , LName varchar(30) , gender varchar(10) , primary key(dId));
Query OK, 0 rows affected (0.09 sec)

mysql> describe director;
+--------+-------------+------+-----+---------+-------+
| Field  | Type        | Null | Key | Default | Extra |
+--------+-------------+------+-----+---------+-------+
| dId    | varchar(6)  | NO   | PRI | NULL    |       |
| FName  | varchar(30) | YES  |     | NULL    |       |
| LName  | varchar(30) | YES  |     | NULL    |       |
| gender | varchar(10) | YES  |     | NULL    |       |
+--------+-------------+------+-----+---------+-------+
4 rows in set (0.00 sec)

mysql> insert into director values('D01' , 'Satyajit' , 'Ray' , 'Male');
Query OK, 1 row affected (0.01 sec)

mysql> insert into director values('D02' , 'Raj' , 'Kapoor' , 'Male');
Query OK, 1 row affected (0.00 sec)

mysql> insert into director values('D03' , 'Zoya' , 'Akhtar' , 'Female');
Query OK, 1 row affected (0.00 sec)

mysql> select * from director;
+-----+----------+--------+--------+
| dId | FName    | LName  | gender |
+-----+----------+--------+--------+
| D01 | Satyajit | Ray    | Male   |
| D02 | Raj      | Kapoor | Male   |
| D03 | Zoya     | Akhtar | Female |
+-----+----------+--------+--------+
3 rows in set (0.00 sec)

mysql> create table direct(mId varchar(6) , dId varchar(6) , foreign key (movieId) references movie(movieId) , foreign key (dId) references director(dId));
ERROR 1072 (42000): Key column 'movieId' doesn't exist in table
mysql> create table direct(movieId varchar(6) , dId varchar(6) , foreign key (movieId) references movie(movieId) , foreign key (dId) references director(dId));
Query OK, 0 rows affected (0.09 sec)

mysql> describe direct;
+---------+------------+------+-----+---------+-------+
| Field   | Type       | Null | Key | Default | Extra |
+---------+------------+------+-----+---------+-------+
| movieId | varchar(6) | YES  | MUL | NULL    |       |
| dId     | varchar(6) | YES  | MUL | NULL    |       |
+---------+------------+------+-----+---------+-------+
2 rows in set (0.00 sec)

mysql> select * from direct;
Empty set (0.00 sec)

mysql> insert into director values('D04' , 'Preeti' , 'Aneja' , 'Female');
Query OK, 1 row affected (0.00 sec)

mysql> select * from director;
+-----+----------+--------+--------+
| dId | FName    | LName  | gender |
+-----+----------+--------+--------+
| D01 | Satyajit | Ray    | Male   |
| D02 | Raj      | Kapoor | Male   |
| D03 | Zoya     | Akhtar | Female |
| D04 | Preeti   | Aneja  | Female |
+-----+----------+--------+--------+
4 rows in set (0.00 sec)

mysql> insert into direct values('M02' , 'D01');
ERROR 1452 (23000): Cannot add or update a child row: a foreign key constraint fails (`movie`.`direct`, CONSTRAINT `direct_ibfk_1` FOREIGN KEY (`movieId`) REFERENCES `movie` (`movieId`))
mysql> insert into direct values('A2F' , 'D01');
Query OK, 1 row affected (0.00 sec)

mysql> insert into direct values('A2G' , 'D02');
Query OK, 1 row affected (0.00 sec)

mysql> insert into direct values('BFC' , 'D03');
Query OK, 1 row affected (0.00 sec)

mysql> select * from direct;
+---------+------+
| movieId | dId  |
+---------+------+
| A2F     | D01  |
| A2G     | D02  |
| BFC     | D03  |
+---------+------+
3 rows in set (0.00 sec)

mysql> select * from director;
+-----+----------+--------+--------+
| dId | FName    | LName  | gender |
+-----+----------+--------+--------+
| D01 | Satyajit | Ray    | Male   |
| D02 | Raj      | Kapoor | Male   |
| D03 | Zoya     | Akhtar | Female |
| D04 | Preeti   | Aneja  | Female |
+-----+----------+--------+--------+
4 rows in set (0.00 sec)

mysql> select * from movie;
+---------+------------------------+-------------+-----------+
| movieId | title                  | releaseDate | movieRank |
+---------+------------------------+-------------+-----------+
| A2F     | Mard Ki Zabaan         | 1988-12-08  | B+        |
| A2G     | Maa Kasam Badla Loonga | 1987-02-14  | A+        |
| BFC     | Godzilla Mere Saathi   | 2015-08-22  | A         |
+---------+------------------------+-------------+-----------+
3 rows in set (0.00 sec)

mysql> create table actor(aId varchar(6) , FName varchar(30) , LName varchar(30) , primary key(aId));
Query OK, 0 rows affected (0.09 sec)

mysql> insert into actor values('AC1' , 'Aamir' , 'Khan');
Query OK, 1 row affected (0.00 sec)

mysql> insert into actor values('AC2' , 'Akshay' , 'Kumar');
Query OK, 1 row affected (0.00 sec)

mysql> insert into actor values('AC3' , 'Ajay' , 'Devgn');
Query OK, 1 row affected (0.00 sec)

mysql> select * from actor;
+-----+--------+-------+
| aId | FName  | LName |
+-----+--------+-------+
| AC1 | Aamir  | Khan  |
| AC2 | Akshay | Kumar |
| AC3 | Ajay   | Devgn |
+-----+--------+-------+
3 rows in set (0.00 sec)

mysql> create table casting(movieId varchar(6) , aId , varchar(6) , role varvhar(30) , foreign key(movieId) references movie(movieId) , foreign key(aId) references actor(aId));
ERROR 1064 (42000): You have an error in your SQL syntax; check the manual that corresponds to your MySQL server version for the right syntax to use near ', varchar(6) , role varvhar(30) , foreign key(movieId) references movie(movieId)' at line 1
mysql> create table casting(movieId varchar(6) , aId varchar(6) , role varvhar(30) , foreign key(movieId) references movie(movieId) , foreign key(aId) references actor(aId));
ERROR 1064 (42000): You have an error in your SQL syntax; check the manual that corresponds to your MySQL server version for the right syntax to use near 'varvhar(30) , foreign key(movieId) references movie(movieId) , foreign key(aId) ' at line 1
mysql> create table casting(movieId varchar(6) , aId varchar(6) , role varvhar(30) , foreign key (movieId) references movie(movieId) , foreign key (aId) references actor(aId));
ERROR 1064 (42000): You have an error in your SQL syntax; check the manual that corresponds to your MySQL server version for the right syntax to use near 'varvhar(30) , foreign key (movieId) references movie(movieId) , foreign key (aId' at line 1
mysql> create table casting(movieId varchar(6) , aId varchar(6) , movieRole varvhar(30) , foreign key (movieId) references movie(movieId) , foreign key (aId) references actor(aId));
ERROR 1064 (42000): You have an error in your SQL syntax; check the manual that corresponds to your MySQL server version for the right syntax to use near 'varvhar(30) , foreign key (movieId) references movie(movieId) , foreign key (aId' at line 1
mysql> create table movieCast(movieId varchar(6) , aId varchar(6) , role varchar(30) , foreign key(movieId) references movie(movieId) , foreign key(aId) references actor(aId));
Query OK, 0 rows affected (0.15 sec)

mysql> insert into casting values('A2G' , 'AC1' , 'Hero');
ERROR 1146 (42S02): Table 'movie.casting' doesn't exist
mysql> insert into movieCast values('A2G' , 'AC1' , 'Hero');
Query OK, 1 row affected (0.00 sec)

mysql> insert into movieCast values('BFC' , 'AC2' , 'Side role');
Query OK, 1 row affected (0.00 sec)

mysql> select * from movieCast;
+---------+------+-----------+
| movieId | aId  | role      |
+---------+------+-----------+
| A2G     | AC1  | Hero      |
| BFC     | AC2  | Side role |
+---------+------+-----------+
2 rows in set (0.00 sec)

mysql> create view movieList as select movieId from direct where dId = 'D02'
    -> ;
Query OK, 0 rows affected (0.02 sec)

mysql> select * from movieList;
+---------+
| movieId |
+---------+
| A2G     |
+---------+
1 row in set (0.00 sec)

mysql> select * from direct;
+---------+------+
| movieId | dId  |
+---------+------+
| A2F     | D01  |
| A2G     | D02  |
| BFC     | D03  |
+---------+------+
3 rows in set (0.00 sec)

mysql> create movieList as select direct.movieId , direct.dId from dierct , movie where direct.dId = 'D01' and movie.movieRank = 'A+';
ERROR 1064 (42000): You have an error in your SQL syntax; check the manual that corresponds to your MySQL server version for the right syntax to use near 'movieList as select direct.movieId , direct.dId from dierct , movie where direct' at line 1
mysql> create view movieList as select direct.movieId , direct.dId from dierct , movie where direct.dId = 'D01' and movie.movieRank = 'A+';
ERROR 1146 (42S02): Table 'movie.dierct' doesn't exist
mysql> create view movieList as select direct.movieId , direct.dId from direct , movie where direct.dId = 'D01' and movie.movieRank = 'A+';
ERROR 1050 (42S01): Table 'movieList' already exists
mysql> replace view movieList as select direct.movieId , direct.dId from direct , movie where direct.dId = 'D01' and movie.movieRank = 'A+';
ERROR 1064 (42000): You have an error in your SQL syntax; check the manual that corresponds to your MySQL server version for the right syntax to use near 'movieList as select direct.movieId , direct.dId from direct , movie where direct' at line 1
mysql> create or replace view movieList as select direct.movieId , direct.dId from direct , movie where direct.dId = 'D01' and movie.movieRank = 'A+';
Query OK, 0 rows affected (0.01 sec)

mysql> select * from movieList;
+---------+------+
| movieId | dId  |
+---------+------+
| A2F     | D01  |
+---------+------+
1 row in set (0.00 sec)

mysql> select * from movieCast;
+---------+------+-----------+
| movieId | aId  | role      |
+---------+------+-----------+
| A2G     | AC1  | Hero      |
| BFC     | AC2  | Side role |
+---------+------+-----------+
2 rows in set (0.00 sec)

mysql> alter table direct add sNo int auto_increment primary key;
Query OK, 0 rows affected (0.19 sec)
Records: 0  Duplicates: 0  Warnings: 0

mysql> select * from direct;
+---------+------+-----+
| movieId | dId  | sNo |
+---------+------+-----+
| A2F     | D01  |   1 |
| A2G     | D02  |   2 |
| BFC     | D03  |   3 |
+---------+------+-----+
3 rows in set (0.00 sec)

mysql> delete from direct where sNo = 2;
Query OK, 1 row affected (0.01 sec)

mysql> select * from direct;
+---------+------+-----+
| movieId | dId  | sNo |
+---------+------+-----+
| A2F     | D01  |   1 |
| BFC     | D03  |   3 |
+---------+------+-----+
2 rows in set (0.00 sec)

mysql> update direct set sNo = 4 where sNo = 3;
Query OK, 1 row affected (0.01 sec)
Rows matched: 1  Changed: 1  Warnings: 0

mysql> select * from direct;
+---------+------+-----+
| movieId | dId  | sNo |
+---------+------+-----+
| A2F     | D01  |   1 |
| BFC     | D03  |   4 |
+---------+------+-----+
2 rows in set (0.00 sec)

mysql> show tables;
+-----------------+
| Tables_in_movie |
+-----------------+
| actor           |
| direct          |
| director        |
| movie           |
| moviecast       |
| movielist       |
+-----------------+
6 rows in set (0.01 sec)

mysql> drop table direct;
Query OK, 0 rows affected (0.09 sec)

mysql> show tables;
+-----------------+
| Tables_in_movie |
+-----------------+
| actor           |
| director        |
| movie           |
| moviecast       |
| movielist       |
+-----------------+
5 rows in set (0.00 sec)

mysql>