Enter password: ******
Welcome to the MySQL monitor.  Commands end with ; or \g.
Your MySQL connection id is 11
Server version: 8.0.20 MySQL Community Server - GPL

Copyright (c) 2000, 2020, Oracle and/or its affiliates. All rights reserved.

Oracle is a registered trademark of Oracle Corporation and/or its
affiliates. Other names may be trademarks of their respective
owners.

Type 'help;' or '\h' for help. Type '\c' to clear the current input statement.

mysql> show databases;
+--------------------+
| Database           |
+--------------------+
| banking            |
| himanshu           |
| information_schema |
| movie              |
| mysql              |
| performance_schema |
| sakila             |
| sys                |
| world              |
+--------------------+
9 rows in set (0.01 sec)

mysql> use movie;
Database changed
mysql> show tables;
+-----------------+
| Tables_in_movie |
+-----------------+
| actor           |
| director        |
| movie           |
| moviecast       |
| movielist       |
+-----------------+
5 rows in set (0.00 sec)

mysql> describe movielist;
ERROR 1356 (HY000): View 'movie.movielist' references invalid table(s) or column(s) or function(s) or definer/invoker of view lack rights to use them
mysql> select * from movielist;
ERROR 1356 (HY000): View 'movie.movielist' references invalid table(s) or column(s) or function(s) or definer/invoker of view lack rights to use them
mysql> select * from movieList;
ERROR 1356 (HY000): View 'movie.movielist' references invalid table(s) or column(s) or function(s) or definer/invoker of view lack rights to use them
mysql> create table direct(movieId varchar(6) , dId varchar(6) , foreign key (movieId) references movie(movieId) , foreign key (dId) references director(dId));
Query OK, 0 rows affected (0.10 sec)

mysql> describe direct;
+---------+------------+------+-----+---------+-------+
| Field   | Type       | Null | Key | Default | Extra |
+---------+------------+------+-----+---------+-------+
| movieId | varchar(6) | YES  | MUL | NULL    |       |
| dId     | varchar(6) | YES  | MUL | NULL    |       |
+---------+------------+------+-----+---------+-------+
2 rows in set (0.00 sec)

mysql> insert into direct values('A2F' , 'D01');
Query OK, 1 row affected (0.00 sec)

mysql> insert into direct values('A2G' , 'D02');
Query OK, 1 row affected (0.02 sec)

mysql> insert into direct values('BFC' , 'D03');
Query OK, 1 row affected (0.00 sec)

mysql> describe movieList;
+---------+------------+------+-----+---------+-------+
| Field   | Type       | Null | Key | Default | Extra |
+---------+------------+------+-----+---------+-------+
| movieId | varchar(6) | YES  |     | NULL    |       |
| dId     | varchar(6) | YES  |     | NULL    |       |
+---------+------------+------+-----+---------+-------+
2 rows in set (0.00 sec)

mysql> select * from movieList;
+---------+------+
| movieId | dId  |
+---------+------+
| A2F     | D01  |
+---------+------+
1 row in set (0.00 sec)

mysql> select * from movie;
+---------+------------------------+-------------+-----------+
| movieId | title                  | releaseDate | movieRank |
+---------+------------------------+-------------+-----------+
| A2F     | Mard Ki Zabaan         | 1988-12-08  | B+        |
| A2G     | Maa Kasam Badla Loonga | 1987-02-14  | A+        |
| BFC     | Godzilla Mere Saathi   | 2015-08-22  | A         |
+---------+------------------------+-------------+-----------+
3 rows in set (0.00 sec)

mysql> insert into movie values('M01' , 'Airlift' , '2018-04-09' , 'A');
Query OK, 1 row affected (0.01 sec)

mysql> insert into movie values('M02' , 'Lagaan' , '2010-03-03' , 'A');
Query OK, 1 row affected (0.00 sec)

mysql> insert into movie values('M03' , 'PK' , '2018-01-01' , 'B');
Query OK, 1 row affected (0.00 sec)

mysql> insert into movie values('M04' , 'War' , '2020-04-09' , 'C');
Query OK, 1 row affected (0.01 sec)

mysql> insert into movie values('M05' , 'Dangal' , '2019-02-01' , 'A');
Query OK, 1 row affected (0.01 sec)

mysql> insert into movie values('M06' , 'Random' , '2020-08-01' , 'D');
Query OK, 1 row affected (0.01 sec)

mysql> select * from actor;
+-----+--------+-------+
| aId | FName  | LName |
+-----+--------+-------+
| AC1 | Aamir  | Khan  |
| AC2 | Akshay | Kumar |
| AC3 | Ajay   | Devgn |
+-----+--------+-------+
3 rows in set (0.00 sec)

mysql> select movieId , title from movie;
+---------+------------------------+
| movieId | title                  |
+---------+------------------------+
| A2F     | Mard Ki Zabaan         |
| A2G     | Maa Kasam Badla Loonga |
| BFC     | Godzilla Mere Saathi   |
| M01     | Airlift                |
| M02     | Lagaan                 |
| M03     | PK                     |
| M04     | War                    |
| M05     | Dangal                 |
| M06     | Random                 |
+---------+------------------------+
9 rows in set (0.00 sec)

mysql> select * from director;
+-----+----------+--------+--------+
| dId | FName    | LName  | gender |
+-----+----------+--------+--------+
| D01 | Satyajit | Ray    | Male   |
| D02 | Raj      | Kapoor | Male   |
| D03 | Zoya     | Akhtar | Female |
| D04 | Preeti   | Aneja  | Female |
+-----+----------+--------+--------+
4 rows in set (0.00 sec)

mysql> insert into director values('D05' , 'Yash' , 'Chopra' , 'Male');
Query OK, 1 row affected (0.00 sec)

mysql> select * from movie , director where director.FName = 'Yash' and director.LName = 'Chopra';
+---------+------------------------+-------------+-----------+-----+-------+--------+--------+
| movieId | title                  | releaseDate | movieRank | dId | FName | LName  | gender |
+---------+------------------------+-------------+-----------+-----+-------+--------+--------+
| A2F     | Mard Ki Zabaan         | 1988-12-08  | B+        | D05 | Yash  | Chopra | Male   |
| A2G     | Maa Kasam Badla Loonga | 1987-02-14  | A+        | D05 | Yash  | Chopra | Male   |
| BFC     | Godzilla Mere Saathi   | 2015-08-22  | A         | D05 | Yash  | Chopra | Male   |
| M01     | Airlift                | 2018-04-09  | A         | D05 | Yash  | Chopra | Male   |
| M02     | Lagaan                 | 2010-03-03  | A         | D05 | Yash  | Chopra | Male   |
| M03     | PK                     | 2018-01-01  | B         | D05 | Yash  | Chopra | Male   |
| M04     | War                    | 2020-04-09  | C         | D05 | Yash  | Chopra | Male   |
| M05     | Dangal                 | 2019-02-01  | A         | D05 | Yash  | Chopra | Male   |
| M06     | Random                 | 2020-08-01  | D         | D05 | Yash  | Chopra | Male   |
+---------+------------------------+-------------+-----------+-----+-------+--------+--------+
9 rows in set (0.00 sec)

mysql> select * from movie;
+---------+------------------------+-------------+-----------+
| movieId | title                  | releaseDate | movieRank |
+---------+------------------------+-------------+-----------+
| A2F     | Mard Ki Zabaan         | 1988-12-08  | B+        |
| A2G     | Maa Kasam Badla Loonga | 1987-02-14  | A+        |
| BFC     | Godzilla Mere Saathi   | 2015-08-22  | A         |
| M01     | Airlift                | 2018-04-09  | A         |
| M02     | Lagaan                 | 2010-03-03  | A         |
| M03     | PK                     | 2018-01-01  | B         |
| M04     | War                    | 2020-04-09  | C         |
| M05     | Dangal                 | 2019-02-01  | A         |
| M06     | Random                 | 2020-08-01  | D         |
+---------+------------------------+-------------+-----------+
9 rows in set (0.00 sec)

mysql> select * from direct;
+---------+------+
| movieId | dId  |
+---------+------+
| A2F     | D01  |
| A2G     | D02  |
| BFC     | D03  |
+---------+------+
3 rows in set (0.00 sec)

mysql> insert into direct values('M04' , 'D05');
Query OK, 1 row affected (0.01 sec)

mysql> insert into direct values('M03' , 'D05');
Query OK, 1 row affected (0.01 sec)

mysql> insert into direct values('M01' , 'D05');
Query OK, 1 row affected (0.01 sec)

mysql> select * from direct , movie , director where director.FName = 'Yash' and director.LName = 'Chopra' and direct.dId = director.dId and direct.movieId = movie.movieId;
+---------+------+---------+---------+-------------+-----------+-----+-------+--------+--------+
| movieId | dId  | movieId | title   | releaseDate | movieRank | dId | FName | LName  | gender |
+---------+------+---------+---------+-------------+-----------+-----+-------+--------+--------+
| M04     | D05  | M04     | War     | 2020-04-09  | C         | D05 | Yash  | Chopra | Male   |
| M03     | D05  | M03     | PK      | 2018-01-01  | B         | D05 | Yash  | Chopra | Male   |
| M01     | D05  | M01     | Airlift | 2018-04-09  | A         | D05 | Yash  | Chopra | Male   |
+---------+------+---------+---------+-------------+-----------+-----+-------+--------+--------+
3 rows in set (0.00 sec)

mysql> insert into actor values('AC4' , 'Amir' , 'Khan');
Query OK, 1 row affected (0.01 sec)

mysql> select * from actor;
+-----+--------+-------+
| aId | FName  | LName |
+-----+--------+-------+
| AC1 | Aamir  | Khan  |
| AC2 | Akshay | Kumar |
| AC3 | Ajay   | Devgn |
| AC4 | Amir   | Khan  |
+-----+--------+-------+
4 rows in set (0.00 sec)

mysql> insert into actor values('AC4' , 'Aamir' , 'Khan');
ERROR 1062 (23000): Duplicate entry 'AC4' for key 'actor.PRIMARY'
mysql> insert into actor values('AC5' , 'Aamir' , 'Khan');
Query OK, 1 row affected (0.00 sec)

mysql> select * from actor;
+-----+--------+-------+
| aId | FName  | LName |
+-----+--------+-------+
| AC1 | Aamir  | Khan  |
| AC2 | Akshay | Kumar |
| AC3 | Ajay   | Devgn |
| AC4 | Amir   | Khan  |
| AC5 | Aamir  | Khan  |
+-----+--------+-------+
5 rows in set (0.00 sec)

mysql> select distinct FName , LName from actor;
+--------+-------+
| FName  | LName |
+--------+-------+
| Aamir  | Khan  |
| Akshay | Kumar |
| Ajay   | Devgn |
| Amir   | Khan  |
+--------+-------+
4 rows in set (0.00 sec)

mysql> select * from movie;
+---------+------------------------+-------------+-----------+
| movieId | title                  | releaseDate | movieRank |
+---------+------------------------+-------------+-----------+
| A2F     | Mard Ki Zabaan         | 1988-12-08  | B+        |
| A2G     | Maa Kasam Badla Loonga | 1987-02-14  | A+        |
| BFC     | Godzilla Mere Saathi   | 2015-08-22  | A         |
| M01     | Airlift                | 2018-04-09  | A         |
| M02     | Lagaan                 | 2010-03-03  | A         |
| M03     | PK                     | 2018-01-01  | B         |
| M04     | War                    | 2020-04-09  | C         |
| M05     | Dangal                 | 2019-02-01  | A         |
| M06     | Random                 | 2020-08-01  | D         |
+---------+------------------------+-------------+-----------+
9 rows in set (0.00 sec)

mysql> alter table actor add Pay int;
Query OK, 0 rows affected (0.05 sec)
Records: 0  Duplicates: 0  Warnings: 0

mysql> describe actor;
+-------+-------------+------+-----+---------+-------+
| Field | Type        | Null | Key | Default | Extra |
+-------+-------------+------+-----+---------+-------+
| aId   | varchar(6)  | NO   | PRI | NULL    |       |
| FName | varchar(30) | YES  |     | NULL    |       |
| LName | varchar(30) | YES  |     | NULL    |       |
| Pay   | int         | YES  |     | NULL    |       |
+-------+-------------+------+-----+---------+-------+
4 rows in set (0.00 sec)

mysql> select * from actor;
+-----+--------+-------+------+
| aId | FName  | LName | Pay  |
+-----+--------+-------+------+
| AC1 | Aamir  | Khan  | NULL |
| AC2 | Akshay | Kumar | NULL |
| AC3 | Ajay   | Devgn | NULL |
| AC4 | Amir   | Khan  | NULL |
| AC5 | Aamir  | Khan  | NULL |
+-----+--------+-------+------+
5 rows in set (0.00 sec)

mysql> select * from movieCast;
+---------+------+-----------+
| movieId | aId  | role      |
+---------+------+-----------+
| A2G     | AC1  | Hero      |
| BFC     | AC2  | Side role |
+---------+------+-----------+
2 rows in set (0.00 sec)

mysql> describe movieCast;
+---------+-------------+------+-----+---------+-------+
| Field   | Type        | Null | Key | Default | Extra |
+---------+-------------+------+-----+---------+-------+
| movieId | varchar(6)  | YES  | MUL | NULL    |       |
| aId     | varchar(6)  | YES  | MUL | NULL    |       |
| role    | varchar(30) | YES  |     | NULL    |       |
+---------+-------------+------+-----+---------+-------+
3 rows in set (0.00 sec)

mysql> alter table add sNo int auto_increment primary key;
ERROR 1064 (42000): You have an error in your SQL syntax; check the manual that corresponds to your MySQL server version for the right syntax to use near 'add sNo int auto_increment primary key' at line 1
mysql> alter table movieCast add sNo int auto_increment primary key;
Query OK, 0 rows affected (0.17 sec)
Records: 0  Duplicates: 0  Warnings: 0

mysql> select * from movieCast;
+---------+------+-----------+-----+
| movieId | aId  | role      | sNo |
+---------+------+-----------+-----+
| A2G     | AC1  | Hero      |   1 |
| BFC     | AC2  | Side role |   2 |
+---------+------+-----------+-----+
2 rows in set (0.00 sec)

mysql> update actor set actor.Pay
    ->  = 60000 where aId = AC1;
ERROR 1054 (42S22): Unknown column 'AC1' in 'where clause'
mysql> update actor set actor.Pay = 60000 where aId = 'AC1';
Query OK, 1 row affected (0.01 sec)
Rows matched: 1  Changed: 1  Warnings: 0

mysql> select * from actor;
+-----+--------+-------+-------+
| aId | FName  | LName | Pay   |
+-----+--------+-------+-------+
| AC1 | Aamir  | Khan  | 60000 |
| AC2 | Akshay | Kumar |  NULL |
| AC3 | Ajay   | Devgn |  NULL |
| AC4 | Amir   | Khan  |  NULL |
| AC5 | Aamir  | Khan  |  NULL |
+-----+--------+-------+-------+
5 rows in set (0.00 sec)

mysql> update actor set actor.Pay = 50000 where aId = 'AC2';
Query OK, 1 row affected (0.02 sec)
Rows matched: 1  Changed: 1  Warnings: 0

mysql> update actor set actor.Pay = 30000 where aId = 'AC3';
Query OK, 1 row affected (0.01 sec)
Rows matched: 1  Changed: 1  Warnings: 0

mysql> update actor set actor.Pay = 35000 where aId = 'AC4';
Query OK, 1 row affected (0.01 sec)
Rows matched: 1  Changed: 1  Warnings: 0

mysql> update actor set actor.Pay = 80000 where aId = 'AC5';
Query OK, 1 row affected (0.01 sec)
Rows matched: 1  Changed: 1  Warnings: 0

mysql> select * from actor;
+-----+--------+-------+-------+
| aId | FName  | LName | Pay   |
+-----+--------+-------+-------+
| AC1 | Aamir  | Khan  | 60000 |
| AC2 | Akshay | Kumar | 50000 |
| AC3 | Ajay   | Devgn | 30000 |
| AC4 | Amir   | Khan  | 35000 |
| AC5 | Aamir  | Khan  | 80000 |
+-----+--------+-------+-------+
5 rows in set (0.00 sec)

mysql> delete from actor where Pay >= 40000 and Pay <= 70000;
ERROR 1451 (23000): Cannot delete or update a parent row: a foreign key constraint fails (`movie`.`moviecast`, CONSTRAINT `moviecast_ibfk_2` FOREIGN KEY (`aId`) REFERENCES `actor` (`aId`))
mysql> select * from movie where title like 'M%';
+---------+------------------------+-------------+-----------+
| movieId | title                  | releaseDate | movieRank |
+---------+------------------------+-------------+-----------+
| A2F     | Mard Ki Zabaan         | 1988-12-08  | B+        |
| A2G     | Maa Kasam Badla Loonga | 1987-02-14  | A+        |
+---------+------------------------+-------------+-----------+
2 rows in set (0.00 sec)

mysql> select actor.FName , actor.LName from movie where movie.title in (select title from movie where title = 'Lagaan' or title = 'PK');
ERROR 1054 (42S22): Unknown column 'actor.FName' in 'field list'
mysql> select actor.FName , actor.LName from movie , actor where movie.title in (select title from movie where title = 'Lagaan' or title = 'PK');
+--------+-------+
| FName  | LName |
+--------+-------+
| Aamir  | Khan  |
| Aamir  | Khan  |
| Akshay | Kumar |
| Akshay | Kumar |
| Ajay   | Devgn |
| Ajay   | Devgn |
| Amir   | Khan  |
| Amir   | Khan  |
| Aamir  | Khan  |
| Aamir  | Khan  |
+--------+-------+
10 rows in set (0.00 sec)

mysql> select avg(actor.pay) from actor , movie , movieCast where actor.aId = movieCast.aId and movie.movieId = movieCast.movieId and movie.title = 'Airlift';
+----------------+
| avg(actor.pay) |
+----------------+
|           NULL |
+----------------+
1 row in set (0.01 sec)

mysql> select * from movieCast;
+---------+------+-----------+-----+
| movieId | aId  | role      | sNo |
+---------+------+-----------+-----+
| A2G     | AC1  | Hero      |   1 |
| BFC     | AC2  | Side role |   2 |
+---------+------+-----------+-----+
2 rows in set (0.00 sec)

mysql> insert into movieCast values('A2G' , 'AC2' , 'Brother');
ERROR 1136 (21S01): Column count doesn't match value count at row 1
mysql> insert into movieCast values('A2G' , 'AC2' , 'Brother' , 3);
Query OK, 1 row affected (0.01 sec)

mysql> select * from movieCast;
+---------+------+-----------+-----+
| movieId | aId  | role      | sNo |
+---------+------+-----------+-----+
| A2G     | AC1  | Hero      |   1 |
| BFC     | AC2  | Side role |   2 |
| A2G     | AC2  | Brother   |   3 |
+---------+------+-----------+-----+
3 rows in set (0.00 sec)

mysql> select avg(actor.pay) from actor , movie , movieCast where actor.aId = movieCast.aId and movie.movieId = movieCast.movieId and movie.title = 'Maa Kasam Badla Loonga';
+----------------+
| avg(actor.pay) |
+----------------+
|     55000.0000 |
+----------------+
1 row in set (0.00 sec)

mysql> select count(actor.aId) from actor , movie where movie.title = 'Maa Kasam Badla Loonga';
+------------------+
| count(actor.aId) |
+------------------+
|                5 |
+------------------+
1 row in set (0.00 sec)

mysql> select count(actor.aId) from actor , movie , movieCast where movie.title = 'Maa Kasam Badla Loonga' and movieId = movieCast.movieId;
ERROR 1052 (23000): Column 'movieId' in where clause is ambiguous
mysql> select count(actor.aId) from actor , movie , movieCast where movie.title = 'Maa Kasam Badla Loonga' and movie.movieId = movieCast.movieId;
+------------------+
| count(actor.aId) |
+------------------+
|               10 |
+------------------+
1 row in set (0.00 sec)

mysql> select max(actor.pay) , min(actor.pay) from actor , movie , movieCast where actor.aId = movieCast.aId and movie.movieId = movieCast.movieId and movie.title='PK';
+----------------+----------------+
| max(actor.pay) | min(actor.pay) |
+----------------+----------------+
|           NULL |           NULL |
+----------------+----------------+
1 row in set (0.00 sec)

mysql> select max(actor.pay) , min(actor.pay) from actor , movie , movieCast where actor.aId = movieCast.aId and movie.movieId = movieCast.movieId and movie.title='Maa Kasam Badla Loonga';
+----------------+----------------+
| max(actor.pay) | min(actor.pay) |
+----------------+----------------+
|          60000 |          50000 |
+----------------+----------------+
1 row in set (0.00 sec)

mysql> select * from movieCast;
+---------+------+-----------+-----+
| movieId | aId  | role      | sNo |
+---------+------+-----------+-----+
| A2G     | AC1  | Hero      |   1 |
| BFC     | AC2  | Side role |   2 |
| A2G     | AC2  | Brother   |   3 |
+---------+------+-----------+-----+
3 rows in set (0.00 sec)

mysql> select sum(actor.pay) from actor , movie , movieCast where actor.aId = movieCast.aId and movie.movieId = movieCast.movieId and movie.title='Maa Kasam Badla Loonga';
+----------------+
| sum(actor.pay) |
+----------------+
|         110000 |
+----------------+
1 row in set (0.00 sec)

mysql> select * from movie order by title asc , releaseDate desc;
+---------+------------------------+-------------+-----------+
| movieId | title                  | releaseDate | movieRank |
+---------+------------------------+-------------+-----------+
| M01     | Airlift                | 2018-04-09  | A         |
| M05     | Dangal                 | 2019-02-01  | A         |
| BFC     | Godzilla Mere Saathi   | 2015-08-22  | A         |
| M02     | Lagaan                 | 2010-03-03  | A         |
| A2G     | Maa Kasam Badla Loonga | 1987-02-14  | A+        |
| A2F     | Mard Ki Zabaan         | 1988-12-08  | B+        |
| M03     | PK                     | 2018-01-01  | B         |
| M06     | Random                 | 2020-08-01  | D         |
| M04     | War                    | 2020-04-09  | C         |
+---------+------------------------+-------------+-----------+
9 rows in set (0.00 sec)

mysql> select * from movie where title = 'Maa Kasam Badla Loonga' union select * from movie where title = 'Godzilla Mere Saathi';
+---------+------------------------+-------------+-----------+
| movieId | title                  | releaseDate | movieRank |
+---------+------------------------+-------------+-----------+
| A2G     | Maa Kasam Badla Loonga | 1987-02-14  | A+        |
| BFC     | Godzilla Mere Saathi   | 2015-08-22  | A         |
+---------+------------------------+-------------+-----------+
2 rows in set (0.00 sec)

mysql>